id,name,address,inec_code,state_name,state_id,state_inec_code,cscdb_country_id,cscdb_country_code,cscdb_country_name
286,Kaugama,"Yanleman Road, Kaugama Town",,JIGAWA STATE,18,JG,161,NG,Nigeria
287,Kazaure,"Near Police Station, Kazaure",,JIGAWA STATE,18,JG,161,NG,Nigeria
288,Kiri Kasamma,Kiri Kasamma Town,,JIGAWA STATE,18,JG,161,NG,Nigeria
289,Kiyawa,"Dutse Road, Kiyawa  Town",,JIGAWA STATE,18,JG,161,NG,Nigeria
290,Maigatari,"Gumel Road, Maigatari Town",,JIGAWA STATE,18,JG,161,NG,Nigeria
291,Malam Madori,"Near Police Station, Malam Ma",,JIGAWA STATE,18,JG,161,NG,Nigeria
292,Miga,Miga Town,,JIGAWA STATE,18,JG,161,NG,Nigeria
293,Ringim,Near General Hospital Ringim Town,,JIGAWA STATE,18,JG,161,NG,Nigeria
294,Roni,"Near Local Govt. Secretariat, Ronitown",,JIGAWA STATE,18,JG,161,NG,Nigeria
295,Sule Tankarkar,"Gumei Road, Sule Tankarkar Town",,JIGAWA STATE,18,JG,161,NG,Nigeria
296,Taura,"Kano Road, Taura",,JIGAWA STATE,18,JG,161,NG,Nigeria
297,Yankwashi,"Near District Head Office, Yankwashi Town",,JIGAWA STATE,18,JG,161,NG,Nigeria
298,Birnin Gwari,"Savannah Street, Opp. Lga Secretariate, B/Gwari",,KADUNA STATE,19,KD,161,NG,Nigeria
299,Chukun,"Along Kaduna/Kachia Road, Kujama",,KADUNA STATE,19,KD,161,NG,Nigeria
300,Giwa,"No 2 Galadima Road, Giwa",,KADUNA STATE,19,KD,161,NG,Nigeria
301,Igabi,Turunku/Farakwai Road Opp. Lga Secretariat Turunku,,KADUNA STATE,19,KD,161,NG,Nigeria
302,Ikara,"Opposite Lga Secretariat, Ikara",,KADUNA STATE,19,KD,161,NG,Nigeria
303,Jaba,"Off Sabon Gari Road, Behind Div. H/Qtrs, Nigerian Police, Ngarsu-Kwoi",,KADUNA STATE,19,KD,161,NG,Nigeria
304,Jema'a,"Anguwar Rimi Road, Opposite Police Hq, Anguwar Padu, Kafanchan",,KADUNA STATE,19,KD,161,NG,Nigeria
305,Kachia,"No 2 Makarfi Road, Kachia",,KADUNA STATE,19,KD,161,NG,Nigeria
306,Kaduna North,"Abubakar Kigo Road, Magajin Gari, Kaduna",,KADUNA STATE,19,KD,161,NG,Nigeria
307,Kaduna South,"Somalia Road, Opp. Barnawa Police Station, Low Cost, Barnawa",,KADUNA STATE,19,KD,161,NG,Nigeria
308,Kagarko,"Inside Lga Secretariat Building, Kajuru",,KADUNA STATE,19,KD,161,NG,Nigeria
309,Kajuru,"No 4. Opposite Lga Secretariat, Kajuru",,KADUNA STATE,19,KD,161,NG,Nigeria
310,Kaura,"Near Kaura Market Square, Along Kaura-Manchok Road",,KADUNA STATE,19,KD,161,NG,Nigeria
311,Kauru,"Along Police Station/Lga Secretariate, Kaura",,KADUNA STATE,19,KD,161,NG,Nigeria
312,Kubau,"Old Dispensary Building, Sani Abacha Way, Takalifya, Anchau",,KADUNA STATE,19,KD,161,NG,Nigeria
313,Kudan,Along Main Street In Kunkuyi Town,,KADUNA STATE,19,KD,161,NG,Nigeria
314,Lere,Along Lga Secretariat Saminaka,,KADUNA STATE,19,KD,161,NG,Nigeria
315,Makarfi,"Governor Road, Adjacent To Lga Secretariat, Makarfi",,KADUNA STATE,19,KD,161,NG,Nigeria
316,Sabon Gari,"No 4 Daurawa Street, Gra, Sabong Ari-Zaria",,KADUNA STATE,19,KD,161,NG,Nigeria
317,Sanga,"Opposite Area Court, Sanga",,KADUNA STATE,19,KD,161,NG,Nigeria
318,Soba,"Along Zaria -JOS Road, Opp. Soba Lga Secretariat, Maigam",,KADUNA STATE,19,KD,161,NG,Nigeria
319,Zaria,"Opp. D/Magaji Market, Along Kaduna-Kano Express Way",,KADUNA STATE,19,KD,161,NG,Nigeria
320,Zangon Kataf,"Opp. Police Station, Kurmi, B. Zonkwa",,KADUNA STATE,19,KD,161,NG,Nigeria
321,Albasu,"Pnda Road, Opp. Lga Secretariat",,KANO STATE,20,KN,161,NG,Nigeria
322,Bagwai,"Main Road Near Islamic Center, Sbong Ari, Bagwai Town",,KANO STATE,20,KN,161,NG,Nigeria
323,Dala,"No 35, Layin Dala Garbaje, Gwammaja Layout, Kano",,KANO STATE,20,KN,161,NG,Nigeria
324,Danbatta,"No 1 Ring Road, Bye-Pass, Kano, Daura Road",,KANO STATE,20,KN,161,NG,Nigeria
325,D/Tofa,Behind Uba D/Tofa Branch,,KANO STATE,20,KN,161,NG,Nigeria
326,Gaya,"Wudil Dutse Road, Near Lga Secretariat, Gaya Town",,KANO STATE,20,KN,161,NG,Nigeria
327,Gwale,"Gwale Filnin Mushe Gwale Quarters, Kano",,KANO STATE,20,KN,161,NG,Nigeria
328,Doguwa,Adjacent To Market Ririwai Town,,KANO STATE,20,KN,161,NG,Nigeria
329,Kibiya,Old Dispensary Building Inside Local Govt. Secretariat,,KANO STATE,20,KN,161,NG,Nigeria
330,Kabo,Behind Lga Secretariat,,KANO STATE,20,KN,161,NG,Nigeria
331,Gezawa,"Gumel Road, Adjacent To Divisional Police Station Gezawa",,KANO STATE,20,KN,161,NG,Nigeria
332,Kunchi,"Opposite District Head Place, Kunchi",,KANO STATE,20,KN,161,NG,Nigeria
333,Karaye,Opp Karaye Lga Secretariat,,KANO STATE,20,KN,161,NG,Nigeria
334,Garum Malan,"Chromawa Road, Garun Malam Town P.M.B 3021",,KANO STATE,20,KN,161,NG,Nigeria
335,Madobi,Adjacent To Madobi Lga Secretariat Madobi Town,,KANO STATE,20,KN,161,NG,Nigeria
336,Gabasawa,"Kano Zazirai Road, Opp. Police Station, Zakirai Town",,KANO STATE,20,KN,161,NG,Nigeria
337,Rimin Gado,"Opp. Lga Secretariat, Gwarzo Road",,KANO STATE,20,KN,161,NG,Nigeria
338,Rogo,"No 13. Surajo Road, Rogo Town",,KANO STATE,20,KN,161,NG,Nigeria
339,Shanono,"Opp. Lga Secretariat, Adjacent To Police Station",,KANO STATE,20,KN,161,NG,Nigeria
340,Municipal,"Zoo Road, Behind Buhari Shopping Complex, Kundila Estate A/Albasu",,KANO STATE,20,KN,161,NG,Nigeria
341,Sumaila,"Opposite Market Near Police Station, Divisional Sumaila Town",,KANO STATE,20,KN,161,NG,Nigeria
342,Tarauni,"No 142 Unguwar Uku Old Motor Park, Zaria Road, Kano",,KANO STATE,20,KN,161,NG,Nigeria
343,Tsanyawa,"Opp. Tsanyawa Ggss, Along Kano Katsina Road",,KANO STATE,20,KN,161,NG,Nigeria
344,Tudun Wada,"Near Zonal Education Office, Along Jos, Kano",,KANO STATE,20,KN,161,NG,Nigeria
345,Tofa,No. Kofar Kudu Tofa Town,,KANO STATE,20,KN,161,NG,Nigeria
346,Takai,Behind Lga Secretariat Taki Town,,KANO STATE,20,KN,161,NG,Nigeria
347,Kura,"Dalili Quarters, Inside Lga Secretariat, Kura Town",,KANO STATE,20,KN,161,NG,Nigeria
348,Warawa,"Inside Local Govt. Secretariat, Warawa Town",,KANO STATE,20,KN,161,NG,Nigeria
349,Garko,"Along Kibiya Road, After Ggss, Garko, Garko Town",,KANO STATE,20,KN,161,NG,Nigeria
350,Ajingi,"No 3 Govt Sec. School Quarters, Ajingi Along, Gss Road, Ajingi",,KANO STATE,20,KN,161,NG,Nigeria
351,Bichi,"Opp. Islamic Centre Katsina Road, Ajingi",,KANO STATE,20,KN,161,NG,Nigeria
352,Minjinbir,"Minjibir Local Govt. Secretariat, Minjibir",,KANO STATE,20,KN,161,NG,Nigeria
353,Rano,"Rano Kano Road, Opp. Police Station, Kano",,KANO STATE,20,KN,161,NG,Nigeria
354,Bunkure,"Bunkure Local Govt. Secretariate, Opp. Treasury Dept. Of The Local  Govt",,KANO STATE,20,KN,161,NG,Nigeria
355,Kiru,"Kiru Kofar Kudu Along Tahfizul Qur'an Way, Kiru City",,KANO STATE,20,KN,161,NG,Nigeria
356,Gwarzo,"Gwarzo Town Along Getso/Karaye Road, Kano State",,KANO STATE,20,KN,161,NG,Nigeria
357,Ungogo,"Along Main Road, To Ungogo Town, Adjacent To Ungogo Lga Secretariate",,KANO STATE,20,KN,161,NG,Nigeria
358,Makoda,Koguna Koguna H/Q Kano State,,KANO STATE,20,KN,161,NG,Nigeria
359,Wudil,"Hisba Office, Wudil, Along Gaya Road, Wudil",,KANO STATE,20,KN,161,NG,Nigeria
360,Nassarawa,"Club Road, Opp. School Health Tech Brigade Qtrs",,KANO STATE,20,KN,161,NG,Nigeria
361,Bebeji,"Layin Kofa, Opp. Lgea, Bebeji Town",,KANO STATE,20,KN,161,NG,Nigeria
362,Faffe,Noman's Land Behind Rent Tribunal Court,,KANO STATE,20,KN,161,NG,Nigeria
363,D/Kudu,"Opp. Science Sec. Sch. Adjacent Lga Secretariat, D/Kudu Town",,KANO STATE,20,KN,161,NG,Nigeria
364,Kumbotso,"Kimbotso Road, Behind Lga Secretariat, Kumboytso Town",,KANO STATE,20,KN,161,NG,Nigeria
365,Baure,"Directly Opposite Police Station, Baure",,KATSINA STATE,21,KT,161,NG,Nigeria
366,Bakori,"Near Bakori Police Station, Along Funtua Road, Bakori",,KATSINA STATE,21,KT,161,NG,Nigeria
367,Bindawa,"Opposite Police Station, Bindawa",,KATSINA STATE,21,KT,161,NG,Nigeria
368,Daura,"Along Katsina Road, Beside Local Govt. Area Secretariat",,KATSINA STATE,21,KT,161,NG,Nigeria
369,Dutsi," Near District Head's Office, Dutsi",,KATSINA STATE,21,KT,161,NG,Nigeria
370,Dutsin-Ma,"Along Isah Kaita College Of Education Road, Dutsin-Ma",,KATSINA STATE,21,KT,161,NG,Nigeria
371,Mani,Behind Local Govt. Area Council Secretariate,,KATSINA STATE,21,KT,161,NG,Nigeria
372,Faskari,"Yankara, Malgora Road, Faskari",,KATSINA STATE,21,KT,161,NG,Nigeria
373,Safana,"New Layout, Safana",,KATSINA STATE,21,KT,161,NG,Nigeria
374,Kafur,"Zaria Road, Opposite Kafur Lga Education Authority",,KATSINA STATE,21,KT,161,NG,Nigeria
375,Katsina,"No 2 Kabir Usman Road, Katsina",,KATSINA STATE,21,KT,161,NG,Nigeria
376,Funtua,"Zaria Road, Behind Central Police Station, Funtua",,KATSINA STATE,21,KT,161,NG,Nigeria
377,Charanchi,"Along Kano Road, Charanchi",,KATSINA STATE,21,KT,161,NG,Nigeria
378,Zango,"Along Custom Barrack Road, Opposite Zango Police Station",,KATSINA STATE,21,KT,161,NG,Nigeria
379,Ingawa,"Along Mani Road, Ingawa",,KATSINA STATE,21,KT,161,NG,Nigeria
380,Musawa,"Musawa Lga General Hospital Road, Musawa",,KATSINA STATE,21,KT,161,NG,Nigeria
381,Mashi,"Mashi Local Govt. Along Katsina-Daura Road, Near Police Station Mashi",,KATSINA STATE,21,KT,161,NG,Nigeria
382,Sabuwa,"Adjacent Divisional Police Office, Gra, Sabuwa",,KATSINA STATE,21,KT,161,NG,Nigeria
383,Kankia,"Kankia Local Govt. Secretariat, Dutsin Ma Road, Kankia",,KATSINA STATE,21,KT,161,NG,Nigeria
384,Kusada,"Opposite Kusada Stream, Kusada",,KATSINA STATE,21,KT,161,NG,Nigeria
385,Kaita,"Along Katsina -KAITA Road, Close To Police Station Kaita",,KATSINA STATE,21,KT,161,NG,Nigeria
386,Rimi,"Opposite Police Station, Rimi",,KATSINA STATE,21,KT,161,NG,Nigeria
387,Malumfashi,"Off Funtua Road, Opposite  Lga Secretariate, M/Fashi",,KATSINA STATE,21,KT,161,NG,Nigeria
388,Kurfi,"Shagara Lowcost Housing Units, Along D/Ma Road, Kurfi",,KATSINA STATE,21,KT,161,NG,Nigeria
389,Sandamu,"Opposite General Hospital, Sandamu",,KATSINA STATE,21,KT,161,NG,Nigeria
390,Matazu,"Along The Road To Matazu Lga Secretariat, Matazu",,KATSINA STATE,21,KT,161,NG,Nigeria
391,Dandume,"42 Yusuf One Maikano Crescent, Along Funtua Birnin Gwari Road, Dandume",,KATSINA STATE,21,KT,161,NG,Nigeria
392,Batagarawa,"Batagarawa Lowcost, Batagarawa",,KATSINA STATE,21,KT,161,NG,Nigeria
393,Jibia,"Magama-Jibia Road, Behind Lga Coucil Secretariat, Jibia",,KATSINA STATE,21,KT,161,NG,Nigeria
394,Batsari,"Katsina Road, Behind Local Govt. Area Coucil Secretariat, Batsari",,KATSINA STATE,21,KT,161,NG,Nigeria
395,Mai'adua,"Behind Lga Council Secretariat, Mai'adua",,KATSINA STATE,21,KT,161,NG,Nigeria
396,Danmusa,"Along Secretariat Road, Danmusa",,KATSINA STATE,21,KT,161,NG,Nigeria
397,Kankara,"Beside Lga Council Secretariate, Kankara",,KATSINA STATE,21,KT,161,NG,Nigeria
398,Danja,"Opposite Market, Off Bakori Road, Danja",,KATSINA STATE,21,KT,161,NG,Nigeria
399,Aliero,"Tadi, Opposite Magistrate Court, Aliero",,KEBBI STATE,22,KB,161,NG,Nigeria
400,Gwandu,Opposite Area Court Gwandu,,KEBBI STATE,22,KB,161,NG,Nigeria
401,Kalgo,Beside Tashar Kalgo,,KEBBI STATE,22,KB,161,NG,Nigeria
402,Bunza,"Marafa Area, Bunza Lga",,KEBBI STATE,22,KB,161,NG,Nigeria
403,Birnin Kebbi,"Ahmadu Bello Way, Opp. Fcmb, Birnin Kebbi",,KEBBI STATE,22,KB,161,NG,Nigeria
404,Suru,"Dakin Gari Town, Tashar Daji Area",,KEBBI STATE,22,KB,161,NG,Nigeria
405,Fakai,"Beside Ifad Office, Mahutu",,KEBBI STATE,22,KB,161,NG,Nigeria
406,Danko Wasagu,Awala Str. Behind Police Div. Ribah,,KEBBI STATE,22,KB,161,NG,Nigeria
407,Bagudo,Along Bagudo Lga Secretariat,,KEBBI STATE,22,KB,161,NG,Nigeria
408,Arewa,"Kabba Road, Oppoiste Lga Secretariat Kangiwa",,KEBBI STATE,22,KB,161,NG,Nigeria
409,Koko/Bersse,"Kurba, Besse Town",,KEBBI STATE,22,KB,161,NG,Nigeria
410,Maiyama,"Along Kontagora Road, Nera Kasuwar Maiyama",,KEBBI STATE,22,KB,161,NG,Nigeria
411,Ngaski,"Sabon Gari Wara, Along Gen Hospital Road, Wara",,KEBBI STATE,22,KB,161,NG,Nigeria
412,Jega,"Bayan Gidan Cinema, Jega Along Mera/Zagi Road, Augie",,KEBBI STATE,22,KB,161,NG,Nigeria
413,Augie,"Along Mera/Zagi Road, Augie",,KEBBI STATE,22,KB,161,NG,Nigeria
414,Argungu,"Gra, Along Sokoto Road Argungu",,KEBBI STATE,22,KB,161,NG,Nigeria
415,Dandi,"New Margaret, Along B/Kebbi Road, Kamba",,KEBBI STATE,22,KB,161,NG,Nigeria
416,Sakaba,"Along Secretariat Road, Birnin Daji",,KEBBI STATE,22,KB,161,NG,Nigeria
417,Shanga,"Shanga Lga Secretariat Opp. Women Centre, Shanga",,KEBBI STATE,22,KB,161,NG,Nigeria
418,Yauri,Ungwar Hutawa Yauri,,KEBBI STATE,22,KB,161,NG,Nigeria
419,Zuru,"Behind Police Station, Zuru",,KEBBI STATE,22,KB,161,NG,Nigeria
420,Adavi,"Beside Local Govt. Despensary, Oba Ngede Junction, Obu Buru",,KOGI STATE,23,KG,161,NG,Nigeria
421,Ajaokuta,"Beside Divisional Police Station, Adogo",,KOGI STATE,23,KG,161,NG,Nigeria
422,Ankpa,"Murtala Muhd Way, Opp. United Bank For Africa (UBA), Ankpa",,KOGI STATE,23,KG,161,NG,Nigeria
423,Bassa,"Beside Ministry Of Education, Oguma, Bassa Lga",,KOGI STATE,23,KG,161,NG,Nigeria
424,Dekina,"Opp. Local Govt. Secretariat, Dekina",,KOGI STATE,23,KG,161,NG,Nigeria
425,Ibaji,Onyedega Beside Ibaji Local Govt. Secretariat,,KOGI STATE,23,KG,161,NG,Nigeria
426,Idah,"Gra, Idah Ayangba Road, Idah Lga",,KOGI STATE,23,KG,161,NG,Nigeria
427,Igalamela/Odolu,"Igalamela Lga Quest House, Ajaka Idah Road, Iga Lamela, Ajaka",,KOGI STATE,23,KG,161,NG,Nigeria
428,Ijumu,"Behind Police Station, Iyara",,KOGI STATE,23,KG,161,NG,Nigeria
429,Kabba/Bunu Lga,"Along Ilorin Road, Beside First Bank",,KOGI STATE,23,KG,161,NG,Nigeria
430,Kogi (KK),"Opposite Ohimage's Palace, Kotonkarfe",,KOGI STATE,23,KG,161,NG,Nigeria
431,Lokoja,"Behind Post Office, Lokoja",,KOGI STATE,23,KG,161,NG,Nigeria
432,Mopamuro,Odere Mop Amuro Logal Govt. Area,,KOGI STATE,23,KG,161,NG,Nigeria
433,Ofu,"Old Local Govt. Road, Gra Quarters, Ugwolawo",,KOGI STATE,23,KG,161,NG,Nigeria
434,Ogori/Mago Ngo,"Akpafa Road, Before Ogori/Magongo Lga Secretariat",,KOGI STATE,23,KG,161,NG,Nigeria
435,Okehi,"Beside Okehi Lga Secretariat, Oba Ngede",,KOGI STATE,23,KG,161,NG,Nigeria
436,Okene,"No. 146 Mission Road, Bariki, Extension, Okene Lga",,KOGI STATE,23,KG,161,NG,Nigeria
437,Olamaboro,"Beside Olamaboro Divisional Police Station, Okpo",,KOGI STATE,23,KG,161,NG,Nigeria
438,Omala,"Omala Lga Secretariat Premiess, Abejukolo",,KOGI STATE,23,KG,161,NG,Nigeria
439,Yagba/East,"Isanlu Beside, Lga Secretariat",,KOGI STATE,23,KG,161,NG,Nigeria
440,Yagba/West,"Egbe Road, Odo-Ere",,KOGI STATE,23,KG,161,NG,Nigeria
441,Asa,"Off Ojoku Road, Behind Police Station, Irede, Afon",,KWARA STATE,24,KW,161,NG,Nigeria
442,Baruten,"Old Baruten Lga Secretariat, Kosubosu",,KWARA STATE,24,KW,161,NG,Nigeria
443,Edu,"Lga Secretariat Area, Gra, Lafiagi",,KWARA STATE,24,KW,161,NG,Nigeria
444,Ekiti,"Old Garage, Osi, Aranorin Opin",,KWARA STATE,24,KW,161,NG,Nigeria
445,Ifelodun,"Ifelodun Lga Secretariat Area, Share",,KWARA STATE,24,KW,161,NG,Nigeria
446,Ilorin East,"Beside Ndlea Office, Opp. Harmony Estate, Akereblata-Sobi Road, Oke-Oyi, Ilorin.",,KWARA STATE,24,KW,161,NG,Nigeria
447,Ilorin South,"Along Fufu-Apaola Road, Beside Lga Secretariat, Fufu",,KWARA STATE,24,KW,161,NG,Nigeria
448,Ilorin West,"Ipata-Oloje Junction, Anifowoshe, Oja-Oba",,KWARA STATE,24,KW,161,NG,Nigeria
449,Irepodun,"Opposite Nepa Sub Station, Omu-Aran",,KWARA STATE,24,KW,161,NG,Nigeria
450,Isin,"Old Lga Secretariat Building, Owu-Isin",,KWARA STATE,24,KW,161,NG,Nigeria
451,Kalama,"Opp. Lga Secretariat, Kalama",,KWARA STATE,24,KW,161,NG,Nigeria
452,Moro,"Ejidongari Road, Opp. Police Station, Bode-Sa’adu",,KWARA STATE,24,KW,161,NG,Nigeria
453,Offa,Inside Off Alga Secretariat,,KWARA STATE,24,KW,161,NG,Nigeria
454,Oke-Ero,"Oke Osin Street, Iloffa",,KWARA STATE,24,KW,161,NG,Nigeria
455,Oyun,"Old Oyun Lga Secretariat, Ilemona",,KWARA STATE,24,KW,161,NG,Nigeria
456,Patigi,"Ipada Bus Stop, Near Union Bank, Patigi",,KWARA STATE,24,KW,161,NG,Nigeria
457,Agege,"Off Old Ipaja Road, Abekoko Agege",,LAGOS STATE,25,LA,161,NG,Nigeria
458,Ajeromi-Ifelodun,"Council Secretariat, Ajegunle",,LAGOS STATE,25,LA,161,NG,Nigeria
459,Alimosho,"Council Secretariat, Ikotun",,LAGOS STATE,25,LA,161,NG,Nigeria
460,Amuwo-Odofin,"Council Secretariat 41 Road, Festac Town",,LAGOS STATE,25,LA,161,NG,Nigeria
461,Apapa,"Council Secretariat, Burma Road, Apapa",,LAGOS STATE,25,LA,161,NG,Nigeria
462,Badagry,"Council Secretariat, Ajara, Badagry",,LAGOS STATE,25,LA,161,NG,Nigeria
463,Epe,"Iraye Road, Epe",,LAGOS STATE,25,LA,161,NG,Nigeria
464,Eti-Osa,"Glover Road, Ikoyi",,LAGOS STATE,25,LA,161,NG,Nigeria
465,Ibeju-Lekki,"Akodo Road, Magbon, Ibeju",,LAGOS STATE,25,LA,161,NG,Nigeria
466,Ifako-Ijaiye,"Agbdo Road, Ojokoro",,LAGOS STATE,25,LA,161,NG,Nigeria
467,Ikeja,"Council Secretariat, Obafemi Awolowo Road, Ikeja",,LAGOS STATE,25,LA,161,NG,Nigeria
468,Ikorodu,"Oriwu Road, Ite-Elewa, Ikorodu",,LAGOS STATE,25,LA,161,NG,Nigeria
469,Kosofe,"Council Secretariat, Ogudu Road, Ojota",,LAGOS STATE,25,LA,161,NG,Nigeria
470,Lagos Island,"Zappas Building, Freeman Str. Lagos-Island",,LAGOS STATE,25,LA,161,NG,Nigeria
471,Lagos-Mainland,"Council Secretariat, Adekunle, Lagos",,LAGOS STATE,25,LA,161,NG,Nigeria
472,Mushin,"Oliyide Str, Mushin",,LAGOS STATE,25,LA,161,NG,Nigeria
473,Ojo,"Council Secretariat, Olojo Drive, Ojo",,LAGOS STATE,25,LA,161,NG,Nigeria
474,Oshodi-Isolo,"Oyetayo Road, Bolade, Oshodi",,LAGOS STATE,25,LA,161,NG,Nigeria
475,Somolu,"Saibu Salami Str. Pedro, Somolu",,LAGOS STATE,25,LA,161,NG,Nigeria
476,Surulere,"Somade Crescent, Surulere",,LAGOS STATE,25,LA,161,NG,Nigeria
477,Akwanga,"Behind Education Department, Akwanga Town.",,NASARAWA STATE,26,NW,161,NG,Nigeria
478,Awe,"Obi Road, Awe",,NASARAWA STATE,26,NW,161,NG,Nigeria
479,Doma,Behind Lga Secretariat,,NASARAWA STATE,26,NW,161,NG,Nigeria
480,Karu,Karu Lga Secretariat,,NASARAWA STATE,26,NW,161,NG,Nigeria
481,Keana,Behind Tormer Lga Secretariat,,NASARAWA STATE,26,NW,161,NG,Nigeria
482,Keffi,Beside Nepa Office,,NASARAWA STATE,26,NW,161,NG,Nigeria
483,Kokona,By Lga Secretariat,,NASARAWA STATE,26,NW,161,NG,Nigeria
484,Lafia,Lafia Local Govt. Area Secretariat,,NASARAWA STATE,26,NW,161,NG,Nigeria
485,Nasarawa,Behind Police Station,,NASARAWA STATE,26,NW,161,NG,Nigeria
486,Nasarawa Egon,"Lafia Road, Nasarawa Egon",,NASARAWA STATE,26,NW,161,NG,Nigeria
487,Obi,Obi Local Govt. Secretariat,,NASARAWA STATE,26,NW,161,NG,Nigeria
488,Toto,Tot Local Govt. Secretariat,,NASARAWA STATE,26,NW,161,NG,Nigeria
489,Wamba,Wamba Logl Govt. Secretariat,,NASARAWA STATE,26,NW,161,NG,Nigeria
490,Agale,"Santali Road, After Lga Secretariat, Agaie",,NIGER STATE,27,NG,161,NG,Nigeria
491, Agwara,"Opposite Police Station, Along Agwara-Borgu Road, Agwara Lga",,NIGER STATE,27,NG,161,NG,Nigeria
492, Bida,"Umaru Magajib Ward, Yahayas, Dangana Way, Bida Lga",,NIGER STATE,27,NG,161,NG,Nigeria
493, Borgu,"Borgu Lga New Bussa, Niger",,NIGER STATE,27,NG,161,NG,Nigeria
494, Bosso,"Along Leg Road, Opp. Baband Abo Primary/Junior Secondary Schoo, Near Divisional Police Station, Maikunkele, Bosso Lga",,NIGER STATE,27,NG,161,NG,Nigeria
495,Chanchaga,"Along Niger State Houseso Assembly Quarters, Western Byepass, Minna",,NIGER STATE,27,NG,161,NG,Nigeria
496,Edati,"Opposite Local Govt. Secretariat Road Edati Lga, Edati",,NIGER STATE,27,NG,161,NG,Nigeria
497,Gbako,"Along Bida-Zungeru Road, Gbako Lga, Lemu",,NIGER STATE,27,NG,161,NG,Nigeria
498,Gurara,"Gwadene Primary School, Gawu Babangida",,NIGER STATE,27,NG,161,NG,Nigeria
499,Katcha,"Gangiarea, Along Loga Secretariat, Katcha Katcha Lga",,NIGER STATE,27,NG,161,NG,Nigeria
500,Kontagora,"Near Hamdala Motors, Along Kontagora-Yauri Road, Kontagoa",,NIGER STATE,27,NG,161,NG,Nigeria
501,Lapai,"Along Minna Road, Beside Pension Office, Lapai",,NIGER STATE,27,NG,161,NG,Nigeria
502,Lavun,"Opposite Plice Station, Along Bida-Mokwa Road, Lavun",,NIGER STATE,27,NG,161,NG,Nigeria
503,Magama,"Off Lga Secretariat Road, Magama Lga, Nasko",,NIGER STATE,27,NG,161,NG,Nigeria
504,Mariga,"Unguwan Sarki, Opposite Central Mosque Bangi",,NIGER STATE,27,NG,161,NG,Nigeria
505,Mashegu,"Adogu, Near Adogu Primary School, Mashegu",,NIGER STATE,27,NG,161,NG,Nigeria
506,Mokwa,"Off Agric Road, Mokwa Lga",,NIGER STATE,27,NG,161,NG,Nigeria
507,Munya,"Munya Lga, Sabon Bari Sarkin Pawa",,NIGER STATE,27,NG,161,NG,Nigeria
508,Paikoro,"Along Old Abuja Road, Adjacent Uk Bello Primary School, Paikoro",,NIGER STATE,27,NG,161,NG,Nigeria
509,Rafi,"Behind Police Barracks, Along Lagos-Kaduna Road, Rafi Lga, Kagara",,NIGER STATE,27,NG,161,NG,Nigeria
510,Rijau,"Dirin-Daji/Tungan Magajiya Road, Junction, Rijau",,NIGER STATE,27,NG,161,NG,Nigeria
511,Shiroro,"Anguwan Chika- Kuta, Near Lag Secretariat, Gussoroo Road, Kuta",,NIGER STATE,27,NG,161,NG,Nigeria
512,Suleja,"Along Suleja Minna Road, Opp. Suleman Barau Technical Collage, Kwamba",,NIGER STATE,27,NG,161,NG,Nigeria
513,Tafa,"Beside The Div. Off. Station, Along Kaduna-Abuja Express Road, Sabo-Wuse, Tafa Lga",,NIGER STATE,27,NG,161,NG,Nigeria
514,Wushishi,"Women Centre, Behind Magistration Court, Along Lemu-Gida Road, Wushishi.",,NIGER STATE,27,NG,161,NG,Nigeria
515,Abeokuta North,"Along Arakanga Water Corporation Road, Akomoje, Abeokuta North",,OGUN STATE,28,OG,161,NG,Nigeria
516,Abeokuta South,"Iyana Mortuary Opp. Local Govt. Education Authority Office, Abeokuta",,OGUN STATE,28,OG,161,NG,Nigeria
517,Ado Odo/Ota,"Local Govt. Area Secretariat, Ota",,OGUN STATE,28,OG,161,NG,Nigeria
518,Egbado North,"Beside Yewa North Loga Secretariat, Ayetoro",,OGUN STATE,28,OG,161,NG,Nigeria
519,Egbado South,"Behind Lga Secretariat, Udjo Road, Ilaro",,OGUN STATE,28,OG,161,NG,Nigeria
520,Ewekoro,"Inside Lga Secretariat, Itori, Ewekoro",,OGUN STATE,28,OG,161,NG,Nigeria
521,Ifo,"Bungalow Area,  Lagos/Abeokuta Express Road, Ifo",,OGUN STATE,28,OG,161,NG,Nigeria
522,Ijebu East,"Off Old Benin Road, Ogbere (AFTER Lga Secretariat)",,OGUN STATE,28,OG,161,NG,Nigeria
523,Ijebu North,"Oke-Agbo Elere Asigbidi Road, Ijebu-Igbo",,OGUN STATE,28,OG,161,NG,Nigeria
524,Ijebu North East,Inside Local Govt. Area Secrtariat,,OGUN STATE,28,OG,161,NG,Nigeria
525,Ijebu-Ode,"Inside Local Govt. Secrtariat, Itoro, Ijebu-Ode",,OGUN STATE,28,OG,161,NG,Nigeria
526,Ikenne,"Beside Water Works, Ikenne",,OGUN STATE,28,OG,161,NG,Nigeria
527,Imeko/Afon,"Behind Motor Park, Imeko",,OGUN STATE,28,OG,161,NG,Nigeria
528,Ipokia,Beside District High,,OGUN STATE,28,OG,161,NG,Nigeria
529,Obafemi/Owode,"Along Lga Secretariat Road, Owode",,OGUN STATE,28,OG,161,NG,Nigeria
530,Odeda,"Beside Egba/Odeda High Schoo, Along Ibadan Road, Odeda",,OGUN STATE,28,OG,161,NG,Nigeria
531,Odogbolu,Licensing Office Building (FIRST Floor) Odogbolu,,OGUN STATE,28,OG,161,NG,Nigeria
532,Ogun Waterside,Along Lga Secretariat Waterside,,OGUN STATE,28,OG,161,NG,Nigeria
533,Remo North,"Along Lga Secretariat Road, Isara",,OGUN STATE,28,OG,161,NG,Nigeria
534,Sagamu,"Opp. Sagamu High Court, Along High Court's Raod, Sagamu.",,OGUN STATE,28,OG,161,NG,Nigeria
535,Akoko North East,"Yame Quarters, Off Oke Agbe Road, Behind Mount Camel School, Ikare",,ONDO STATE,29,OD,161,NG,Nigeria
536,Akoko North West,"Ikarea Mu/Ibaramu Road, Oge Quarters, Oke Agbe",,ONDO STATE,29,OD,161,NG,Nigeria
537,Akoko South East,"Behind Police Station B. Isua Isale Road, Isua Akoko",,ONDO STATE,29,OD,161,NG,Nigeria
538,Akoko Sourth West,"Opp. St. Patricks College, Iwaro-Oka, Oka Akoko",,ONDO STATE,29,OD,161,NG,Nigeria
539,Akure Norh,"Inec Office, Iju",,ONDO STATE,29,OD,161,NG,Nigeria
540,Akure South,"Futa Junction, Cassava Bus Stop, Behind Dpc Pure Water Company",,ONDO STATE,29,OD,161,NG,Nigeria
541,Ese Odo,"Lga Secretariat, Igbekebo",,ONDO STATE,29,OD,161,NG,Nigeria
542,Idanre,"Opp. Our Savour Pry. Schoo, Owena",,ONDO STATE,29,OD,161,NG,Nigeria
543,Ifedore,"Dam Raod, Igbara, Oke",,ONDO STATE,29,OD,161,NG,Nigeria
544,Ilaje,"Gra Quarters, Igbokoda",,ONDO STATE,29,OD,161,NG,Nigeria
545,Ileoluji/Okeigbo,"Old Lge Secretariat, Ile-Oluji",,ONDO STATE,29,OD,161,NG,Nigeria
546,Irele,"Owodunni Street, Ode-Irele",,ONDO STATE,29,OD,161,NG,Nigeria
547,Odigbo,"Orita Odigbo, By Min. Of Education",,ONDO STATE,29,OD,161,NG,Nigeria
548,Okitipupa,"Akure Road, Okitipupa",,ONDO STATE,29,OD,161,NG,Nigeria
549,Ondo East,Behind Old Police Station Bolorunduro,,ONDO STATE,29,OD,161,NG,Nigeria
550,Ondo West,"Akure Road, Ondo",,ONDO STATE,29,OD,161,NG,Nigeria
551,Ose,"Benin-Owo Express Way, Opp. Akure-Owo Park, Ifon",,ONDO STATE,29,OD,161,NG,Nigeria
552,Owo,"Along Old Ikare Road, Beside Water Corporation Office Owo",,ONDO STATE,29,OD,161,NG,Nigeria
553,Atak East,"G 63, Odo-Odi Street, Along Comm. Sec. Sch. Temidire, Iperindo.",,OSUN STATE,30,OS,161,NG,Nigeria
554,Atak West,"Ife Road, Opp. Govt. Tech. College Site, Osu",,OSUN STATE,30,OS,161,NG,Nigeria
555,Ayedaade,"Behind Ayedaade Lga. Secretariat, Gogongan Junction, Gbonga",,OSUN STATE,30,OS,161,NG,Nigeria
556,Ayedire,"Ayedire Lga Secretariat, Ilegbo",,OSUN STATE,30,OS,161,NG,Nigeria
557,Boluwaduro,"Opp. Owa Otan Palace, Ila Road, Otan Ayegbaju",,OSUN STATE,30,OS,161,NG,Nigeria
558,Boripe,"Iragbji Town Hall, Iragbji",,OSUN STATE,30,OS,161,NG,Nigeria
559,Ede North,"Along Ilobu/Erin Road, Camp Youg Area, Ede",,OSUN STATE,30,OS,161,NG,Nigeria
560,Ede South,"Behind Ede South Lga, Secretariat, Oke Iresi, Akoda Road, Ede.",,OSUN STATE,30,OS,161,NG,Nigeria
561,Egbodore,"Opp. Police Station, Along Irageri Road, Awo",,OSUN STATE,30,OS,161,NG,Nigeria
562,Ejigbo,"Opp. Police Station, Along Irageri Road, Awo",,OSUN STATE,30,OS,161,NG,Nigeria
563,Ife Central,"No. 108, Hezekiah Oluwasanmi, Oluorogbo Road, 7, Ile-Ife",,OSUN STATE,30,OS,161,NG,Nigeria
564,Ife East,"No. 27, Omototo Line 3, Ilode, Ile-Ife.",,OSUN STATE,30,OS,161,NG,Nigeria
565,Ife North,"Opp. Fed. Govt. Giris College. Ode Omu Road, Ipettumodu.",,OSUN STATE,30,OS,161,NG,Nigeria
566,Ife South,"Alagbado Street, Beside Police Station, Ifeledo",,OSUN STATE,30,OS,161,NG,Nigeria
567,Ifedayo,"Back Of Ifedayo Lg, Oke-Ila, Orangun",,OSUN STATE,30,OS,161,NG,Nigeria
568,Ifelodun,"Back Of Ifelodun Lga Secretariat, Ikirun",,OSUN STATE,30,OS,161,NG,Nigeria
569,Ila,Behind Women Education Centre Oke-Ogbun Ila-Orangun,,OSUN STATE,30,OS,161,NG,Nigeria
570,Ilesa East,"Beside Ilesa East Lga Secretariat, Along Iyemogun Road, Ilesa",,OSUN STATE,30,OS,161,NG,Nigeria
571,Ilesa West,"Behind Ogedengbe School Of Science, Ilaje, Ilesa",,OSUN STATE,30,OS,161,NG,Nigeria
572,Irepodun,"Opp. Lga Secretaria, Ilobu",,OSUN STATE,30,OS,161,NG,Nigeria
573,Irewole,"Behind Orisunmbare Saw Mill Along Ife/Ibadan Express Way, Ikire",,OSUN STATE,30,OS,161,NG,Nigeria
574,Isokan,"Beside Rasdebuy Filling Station, Along Ibadan Road, Sawmill, Apomu",,OSUN STATE,30,OS,161,NG,Nigeria
